"2019","","","","","","","","","","","","","","","","","","","","","","","","","","","","","","","","","","","","","","","","","","","","","","","","","","","","","","","","","","","","","","","","","","","","","","","","","","","","","","","","","","","","","","","","","","","","","","","","","","","","","","","","","","","","","","","","","","","","","","","","","","","","","","","","","","","","","","","","","","","","","","","","","","","","","","","","","","","","","","","","","","",""
"Submission Details","","","","","","","","","","","","","","","","","","","","","","","","","","","","","","","","","","","","","","","","","","","","Formulário para Coleta de Dados das Atividades de Capacitação de Usuários ","","","","","","","","","","","","","","","","","","","","","","","","","","","","","","","","","","","","","","","","","","","","","","","","","","","","","","","","","","","","","","","","","","","","","","","","","","","","","","","","","","","","","","","","","","","","","","","","","","","","","","","","","","","","","","","","","","","","","","",""
"Serial","SID","Hora do Envio","Completed Time","Modified Time","Draft","Endereço IP","UID","Usuário","Unidade","Número de assentos para usuários","Área Física (em m²) - Total ano anterior","Área Física (em m²) - Ampliação no período","Área Física (em m²) - Redução no período","Funcionários de nível Superior","Funcionários de nível Superior com Especialização","Funcionários de nível Superior com Mestrado","Funcionários de nível Superior com Doutorado","Funcionários de nível Técnico","Funcionários de nível Básico","Funcionários de nível Superior - Vagas não preenchidas","Funcionários de nível Técnico - Vagas não preenchidas","Funcionários de nível Básico - Vagas não preenchidas","Eventos - Superior","Eventos - Técnico","Eventos - Básico","Pós-Graduação - Especialização - Superior","Pós-Graduação - Especialização - Técnico","Pós-Graduação - Especialização - Básico","Pós-Graduação - Mestrado - Superior","Pós-Graduação - Mestrado - Técnico","Pós-Graduação - Mestrado - Básico","Pós-Graduação - Doutorado - Superior","Pós-Graduação - Doutorado - Técnico","Pós-Graduação - Doutorado - Básico","Cursos - Gerencial - Superior","Cursos - Gerencial - Técnico","Cursos - Gerencial - Básico","Cursos - Capacitação para Serviços - Superior","Cursos - Capacitação para Serviços - Técnico","Cursos - Capacitação para Serviços - Básico","Cursos - Tecnologia de Informação e Comunicação (TIC) - Superior","Cursos - Tecnologia de Informação e Comunicação (TIC) - Técnico","Cursos - Tecnologia de Informação e Comunicação (TIC) - Básico","Nome","Filesize (KB)","Livros - Nacional - Compra","Livros - Internacional - Compra","Livros - Nacional - Permuta","Livros - Internacional - Permuta","Livros - Nacional - Doação","Livros - Internacional - Doação","Teses - Nacional - Compra","Teses - Internacional - Compra","Teses - Nacional - Permuta","Teses - Internacional - Permuta","Teses - Nacional - Doação","Teses - Internacional - Doação","Periódicos - Títulos Correntes - Nacional - Compra","Periódicos - Títulos Correntes - Internacional - Compra","Periódicos - Títulos Correntes - Nacional - Permuta","Periódicos - Títulos Correntes - Internacional - Permuta","Periódicos - Títulos Correntes - Nacional - Doação","Periódicos - Títulos Correntes - Internacional - Doação","Multimeios - Nacional - Compra","Multimeios - Internacional - Compra","Multimeios - Nacional - Permuta","Multimeios - Internacional - Permuta","Multimeios - Nacional - Doação","Multimeios - Internacional - Doação","Outros Tipos - Nacional - Compra","Outros Tipos - Internacional - Compra","Outros Tipos - Nacional - Permuta","Outros Tipos - Internacional - Permuta","Outros Tipos - Nacional - Doação","Outros Tipos - Internacional - Doação","Livros - Baixas Efetuadas de Materiais Cadastrados no DEDALUS","Livros - Materiais não Cadastrados no DEDALUS","Teses - Baixas Efetuadas de Materiais Cadastrados no DEDALUS","Teses - Materiais não Cadastrados no DEDALUS","Periódicos (Fascículos) - Materiais cadastrados no DEDALUS até a presente data","Periódicos (Fascículos) - Materiais cadastrados no DEDALUS no ANO (01/01 a 31/12/2019)","Periódicos (Fascículos) - Baixas Efetuadas de Materiais Cadastrados no DEDALUS","Periódicos (Fascículos) - Materiais não Cadastrados no DEDALUS","Multimeios - Baixas Efetuadas de Materiais Cadastrados no DEDALUS","Multimeios - Materiais não Cadastrados no DEDALUS","Outros Tipos - Baixas Efetuadas de Materiais Cadastrados no DEDALUS","Outros Tipos - Materiais não Cadastrados no DEDALUS","Frequência de Usuários - USP","Frequência de Usuários - Locais das Bibliotecas","Consultas ao Acervo","Empréstimo entre Bibliotecas - Como Biblioteca Solicitante","Nacional Como Biblioteca Fornecedora - Número de Pedidos Atendidos - SIBiUSP","Nacional Como Biblioteca Fornecedora - Número de Pedidos NÃO Atendidos - SIBiUSP","Nacional Como Biblioteca Fornecedora - Número de Cópias - SIBiUSP","Nacional Como Biblioteca Fornecedora - Número de Pedidos Atendidos - COMUT","Nacional Como Biblioteca Fornecedora - Número de Pedidos NÃO Atendidos - COMUT","Nacional Como Biblioteca Fornecedora - Número de Cópias - COMUT","Nacional Como Biblioteca Fornecedora - Número de Pedidos Atendidos - BIREME","Nacional Como Biblioteca Fornecedora - Número de Pedidos NÃO Atendidos - BIREME","Nacional Como Biblioteca Fornecedora - Número de Cópias - BIREME","Nacional Como Biblioteca Fornecedora - Número de Pedidos Atendidos - OUTROS","Nacional Como Biblioteca Fornecedora - Número de Pedidos NÃO Atendidos - OUTROS","Nacional Como Biblioteca Fornecedora - Número de Cópias - OUTROS","Internacional Como Biblioteca Fornecedora - Número de Pedidos Atendidos","Internacional Como Biblioteca Fornecedora - Número de Pedidos NÃO Atendidos","Internacional Como Biblioteca Fornecedora - Número de Cópias","Nacional Como Biblioteca Solicitante - Número de Pedidos Atendidos - SIBiUSP","Nacional Como Biblioteca Solicitante - Número de Pedidos NÃO Atendidos - SIBiUSP","Nacional Como Biblioteca Solicitante - Número de Pedidos Atendidos - COMUT","Nacional Como Biblioteca Solicitante - Número de Pedidos NÃO Atendidos - COMUT","Nacional Como Biblioteca Solicitante - Número de Pedidos Atendidos - BIREME","Nacional Como Biblioteca Solicitante - Número de Pedidos NÃO Atendidos - BIREME","Nacional Como Biblioteca Solicitante - Número de Pedidos Atendidos - OUTROS","Nacional Como Biblioteca Solicitante - Número de Pedidos NÃO Atendidos - OUTROS","Internacional Como Biblioteca Solicitante - Número de Pedidos Atendidos","Internacional Como Biblioteca Solicitante - Número de Pedidos NÃO Atendidos","Número de Assistências Efetuadas","Documento como um Todo","Referências Bibliográficas","Microcomputador - Número de Equipamentos para Usuários","Microcomputador - Número de Equipamentos para Funcionários","Impressora - Número de Equipamentos para Usuários","Impressora - Número de Equipamentos para Funcionários","Scanner - Número de Equipamentos para Usuários","Scanner - Número de Equipamentos para Funcionários","Outros - Número de Equipamentos para Usuários","Outros - Número de Equipamentos para Funcionários","Bases de dados","Publicações da Biblioteca","Publicações Oficiais da Unidade com Participação da Biblioteca","Eventos","Projetos","Atividades ligadas à Graduação","Atividades ligadas à Cultura e Extensão","Oferece serviços pela internet?","Possui rede sem fio?","Participa de redes sociais?","Facebook","Twitter","Blog","Flickr","Pinterest","Youtube","Outro","Oferece condições de acessibilidade?","Atendente ou membro da equipe de atendimento treinado na língua brasileira de sinais Libras?","Possui banheiros adaptados?","Possui bebedouros e lavabos adaptados?","Possui Entrada/Saída com dimensionamento?","Possui equipamento eletromecânico (elevadores, esteiras rolantes, entre outros)?","Possui espaço para atendimento adaptado?","Possui mobiliário adaptado?","Possui rampa de acesso com corrimão?","Possui sinalização tátil?","Possui sinalização visual?","Possui sinalização sonora?","Possui ambiente desobstruídos que facilitem a movimentação de cadeirantes e pessoas com deficiência visual?","Possui plano de aquisição gradual de acervo bibliográfico dos conteúdos básicos em formato especial?","Possui acervo em formato especial (Braille/Sonoro)?","Possui websites e aplicações desenvolvidas para que pessoas percebam, compreendam, naveguem e utilizem os serviços oferecidos?","Disponibiliza impressoras em Braille?","Disponibiliza software de leitura para pessoas com baixa visão?","Disponibiliza teclado virtual?"
