"18","237","18/12/2019 - 15:29","29/01/2020 - 11:19","29/01/2020 - 11:19","0","143.107.62.162","176","iri","Instituto de Relações Internacionais","32","301.64","0","0","0","0","2","0","0","0","0","0","0","5","0","0","0","0","0","0","0","0","0","0","0","0","0","0","1","0","0","0","0","0","https://indicadores.abcd.usp.br/sites/default/files/webform/176_1.xlsx","13","34","0","0","0","394","0","0","0","0","0","20","0","0","0","0","0","0","0","0","0","0","0","0","0","0","0","0","0","0","0","0","3.015","0","0","0","0","0","0","0","0","0","0","8.165","383","286","36","0","0","0","0","0","0","0","0","0","3","9","23","13","4","244","0","0","0","0","0","0","3","8","0","0","298","0","0","3","3","0","1","1","1","1","0","Não temos bases de dados mantidas pela Biblioteca.","Não temos publicações elaboradas pela Biblioteca.","Não tivemos em 2019 publicações oficiais do IRI com participação da Biblioteca.","Não tivemos eventos em 2019.","Projeto apresentado junto à Pró-Reitoria de Graduação da Universidade de São Paulo para concorrência no edital PRG/Santander Universidades: Santander e-Grad (edição 2019)
O projeto em nome do Prof. Felipe Pereira Loureiro, presidente da Comissão de Biblioteca do IRI-USP na época, foi contemplado no ano de 2019 com o valor de R$55.000,00 reais. 
O objetivo principal do Projeto é remodelar e equipar um espaço didático de videoconferência na sala de reuniões da Biblioteca do IRI-USP para os alunos de bacharelado de Relações Internacionais do IRI, transformando-o em um local de apoio para as disciplinas de graduação, para grupos de estudo e para instituições discentes de extensão.
A implantação se iniciará em 2020.

","Participação da Biblioteca na Semana de Recepção dos Calouros do IRI organizada pela Graduação com a apresentação da Biblioteca aos alunos.","Não tivemos atividades na Biblioteca ligadas à Cultura e Extensão.","Sim","Sim","Sim","https://www.facebook.com/bibliotecairiusp","https://twitter.com/UspIri","","","","","","Sim","Não","Sim","Sim","Sim","Sim","Não","Não","Não","Não","Não","Não","Não","Não","Não","Não","Não","Não","Não"
"20","239","19/12/2019 - 14:54","23/01/2020 - 12:40","23/01/2020 - 12:40","0","143.107.243.144","156","fo","Faculdade de Odontologia","154","1505.05","0","0","4","1","0","2","7","6","5","3","0","13","8","8","0","0","0","0","0","0","0","0","0","0","0","0","1","2","0","0","0","0","https://indicadores.abcd.usp.br/sites/default/files/webform/156_3.xlsx","13","33","0","0","0","267","63","0","0","0","0","115","0","0","10","0","0","55","23","0","0","0","0","21","0","0","0","0","0","0","0","106","0","78","0","64.784","113","0","0","0","0","0","0","25435","8186","4315","11","42","6","336","111","65","869","0","0","0","65","37","350","0","0","0","7","20","0","0","0","0","0","0","0","0","7596","122","9769","26","19","0","4","0","3","0","1","LILACS
BBO
SECS","SDO em Rede","INFOUSP","Semana do livro e da Biblioteca
Lançamentos de Livros","CRAI
Projeto ""Cultura e Extensão - Aprender com Cultura e e Extensão""","Participação e colaboração ativa da Biblioteca na disciplina ODS0702 - Metodologia Científica","Estagiários","Sim","Sim","Sim","www.facebook.com/sdousp","não","não","não","não","não","","Não","Não","Não","Não","Não","Não","Não","Não","Não","Não","Não","Não","Sim","Não","Não","Não","Não","Não","Não"
"21","240","30/12/2019 - 16:43","31/01/2020 - 16:09","07/02/2020 - 13:29","0","143.107.83.231","141","eca","Escola de Comunicações e Artes","141","1634","0","0","6","0","2","0","10","5","5","1","0","36","4","0","0","0","0","0","0","0","0","0","0","0","0","0","10","4","1","5","2","1","https://indicadores.abcd.usp.br/sites/default/files/webform/141_3.xlsx","23","0","0","0","0","1820","896","0","0","0","0","331","0","5","0","0","0","3","4","0","0","0","0","318","129","0","0","0","0","252","132","54","11436","0","159","78759","741","0","5141","9","25962","26","1032","61803","835","20691","138","7","1","79","11","3","3218","0","0","0","5","0","450","0","0","0","0","0","2","0","0","0","0","0","0","0","80","81","5","17","27","0","2","3","3","11","5","Base Foto: slides, fotos e imagens digitais
Base Cena: Imagens em movimento
Base Sonora: gravações
Base HQ: histórias em quadrinhos","Blog da Biblioteca da ECA
https://bibliotecadaeca.wordpress.com/

Acontece na Biblioteca (boletim)
https://mailchi.mp/3ff13259fa94/acontece-na-biblioteca
","","Introdução ao IIIF Padrões e Ferramentas para a Interoperabilidade de Imagens - apresentada por Sarah Lorenzon no V Congresso Internacional em Tecnologia e Organização da Informação (TOI). Organizado pelo Departamento de Informação e Cultura da ECA. Período: 28 de maio de 2019. Palestra. Participação da Biblioteca na comissão organizadora, divulgação e apresentação da palestra. 

Apropriação da informação - apresentada por Lilian Viana na 40. Semana de estudos de Biblioteconomia. Promovido pela PUC/Campinas. Período: 20 de setembro de 2019. Palestra. Participação da Biblioteca na apresentação da palestra. 

Objetos artísticos em bibliotecas de arte: a experiência da Biblioteca da ECA/USP - apresentada por Marina Macambyra, Sarah Lorenzon Ferreira, Alessandra Vieira Canholi Maldonado no XXVIII Congresso Brasileiro de Biblioteconomia, Documentação e Ciência da Informação – CBBD. Promovido pela FEBAB. Período: 02 de outubro de 2019. Palestra. Participação da Biblioteca na apresentação da palestra.

Biblioteca universitária: mediações da cultura informacional científica e formação de sujeitos do conhecimento - apresentada por Lilian Viana no XXVIII Congresso Brasileiro de Biblioteconomia, Documentação e Ciência da Informação – CBBD. Promovido pela FEBAB. Período: 04 de outubro de 2019. Palestra. Participação da Biblioteca na apresentação da palestra.

Bibliotecas escolares: realidade e perspectivas para o Brasil - apresentada por Lilian Viana na 13. Semana de Biblioteconomia. Organizada pelo Departamento de Informação e Cultura da ECA. Período: 07 de outubro de 2019. Palestra. Participação da Biblioteca na apresentação da palestra.

Relato de experiência na Oficina de encadernação da Biblioteca da ECA - apresentado por Samanta Lessa no 1. Congresso de Ensino de Comunicações, Informação e Artes.  Período: 18 de outubro de 2019. Palestra. Participação da Biblioteca na apresentação da palestra.

Biblioteca universitária e formação de produtores do conhecimento: mediações do patrimônio científico - apresentada por Lilian Viana no Encontro Nacional de Pesquisa em Ciência da Informação. Promovido pela ANCIB. Período: 24 de outubro de 2019. Palestra. Participação da Biblioteca na apresentação da palestra.

Trabalhos de arte em bibliotecas ou O que eu faço com este saquinho de sementes? - apresentado  por Marina Macambyra no IV Seminário de Informação e Documentação em Artes - Interfaces: bibliotecas, museus e arquivos de arte. Organizado pela Redarte - SP  e Departamento de Informação e Cultura da ECA. Período: 28 de novembro de 2019 das 14h às 17h. Seminário. Participação na organização e apresentação da palestra.
","Biblioteca Digital da Produção Artística da ECA/USP
","Elaboração do Manual de normalização da Biblioteca da ECA: complementar às Diretrizes do SIBiUSP 

Elaboração do Modelo prático para formatação de TCC

Preparação da página Guias e Instruções do site da Biblioteca

Participação em disciplinas de graduação a convite dos docentes: Metodologia da Pesquisa em Música; Metodologia da Pesquisa em Ciência da Informação; Documentação Audiovisual; História e Preservação Audiovisual - Filmes em bibliotecas; Trabalho de Conclusão de Curso; Epistemologia do Turismo; Linguagens Documentárias
Preparação de vídeo de apresentação dos espaços da Biblioteca, com a Assistência de Comunicação da ECA","A Escolha de Periódicos para Publicação de Artigo Científico - apresentada  pela bibliotecária da FAU/USP Paola de Marco Lopes dos Santos. Promovido pelo Programa de Pós-Graduação em Ciência da Informação em conjunto com a Biblioteca da ECA. Período: 29 de agosto de 2019.

Oficina de Conservação e pequenos Reparos - oferecida por Samanta Lessa, Robson Rocha e Elisabete Ortiz. Promovida pela Biblioteca da ECA e pelo Departamento de Informação e Cultura da ECA. Período: 04 a 06 de junho de 2019 e 11 a 13 de junho de 2019.
","Sim","Sim","Sim","https://www.facebook.com/ecabiblioteca","https://twitter.com/bibliotecadaeca/","https://bibliotecadaeca.wordpress.com/","https://www.flickr.com/photos/bibliotecadaeca/","https://br.pinterest.com/bibliotecadaeca/","https://www.youtube.com/user/bibliotecadaeca","Instagram: https://www.instagram.com/bibliotecadaeca/","Sim","Não","Sim","Sim","Sim","Não","Sim","Não","Não","Não","Não","Não","Sim","Não","Sim","Não","Não","Sim","Sim"
"22","241","06/01/2020 - 10:23","28/01/2020 - 15:33","28/01/2020 - 15:33","0","143.107.255.30","155","fmvz","Faculdade de Medicina Veterinária e Zootecnia","110","1127.11","0","0","0","3","1","0","9","1","0","0","0","12","6","1","0","0","0","0","0","0","0","0","0","0","0","0","9","4","3","3","7","1","https://indicadores.abcd.usp.br/sites/default/files/webform/155_3.xlsx","14","8","6","0","0","81","0","0","0","0","0","145","0","0","2","0","0","24","13","0","0","0","0","0","0","15","0","0","0","0","0","262","0","12","0","68.543","219","15","0","0","0","35","0","22306","21281","3670","35","9","1","204","15","7","129","0","0","0","64","17","584","10","1","54","9","4","3","1","0","0","0","0","0","0","1162","65","1219","22","22","0","1","1","3","0","14","Base Nacional: VetIndex (5891) / Direve (264)

Base Internacional: Lilacs (1029)","Home page da Biblioteca
http://biblioteca.fmvz.usp.br/","Brazilian Journal of Veterinary Research and Animal Science (Revista da FMVZ/USP)
Periodicidade: Trimestral
Formato: online 
Participação da Biblioteca: Gestão do contrato / Revisão da normalização / Assistência editoral na tramitação dos artigos","Não se aplica","Memória (digitalização da produção científica docente da FMVZ/USP)","Não se aplica","Estande fixo de de troca de livros para a comunidade acadêmica","Sim","Sim","Sim","https://pt-br.facebook.com/bibliotecafmvzusp/","","","","","","Instagram - Biblioteca FMVZ USP","Não","Não","Não","Não","Sim","Não","Não","Não","Não","Não","Não","Não","Sim","Não","Não","Não","Não","Não","Não"
"23","242","07/01/2020 - 09:56","27/01/2020 - 08:51","04/02/2020 - 13:37","0","143.107.4.130","167","iee","Instituto de Energia e Ambiente","12","307","0","0","2","0","0","0","0","0","0","0","0","0","0","0","0","0","0","0","0","0","0","0","0","0","0","0","0","0","0","0","0","0","","","32","0","0","0","32","1","0","0","0","0","76","0","2","4","0","0","9","2","0","0","0","0","0","0","0","0","0","0","0","0","0","30","0","0","43012","0","0","130","0","0","0","0","696","85","684","20","0","0","0","3","3","30","0","0","0","0","0","0","0","0","0","0","0","0","0","0","0","0","0","0","0","124","23","497","4","3","1","0","0","1","0","0","238","não se aplica .","Não se aplica.","Não se aplica.","Não se aplica.","Não se aplica.","Não se aplica.","Sim","Sim","Sim","www.facebook.com/Biblioteca.iee","","","","","","","Sim","Não","Sim","Sim","Sim","Não","Não","Não","Não","Não","Não","Não","Sim","Não","Não","Sim","Não","Não","Não"
"24","243","07/01/2020 - 10:33","07/01/2020 - 11:00","07/01/2020 - 11:00","0","143.107.42.18","172","imt","Instituto de Medicina Tropical de São Paulo","15","90","0","0","1","1","0","0","1","0","0","0","0","0","0","0","0","0","0","0","0","0","0","0","0","0","0","0","0","0","0","0","0","0","","","0","0","0","0","9","5","0","0","0","0","23","0","0","0","0","0","0","0","0","0","0","0","0","0","0","0","0","0","0","0","0","0","0","0","16772","50","0","0","0","0","0","0","4130","1377","143","12","0","0","0","27","0","198","0","0","0","60","0","397","0","0","0","0","0","0","0","0","0","0","0","0","0","314","10","1973","6","2","0","3","0","1","2","0","Não tivemos em 2019","Não tivemos em 2019","Não tivemos em 2019","Não tivemos em 2019","Não tivemos em 2019","Não tivemos em 2019","Não tivemos em 2019","Sim","Sim","Não","","","","","","","","Sim","Não","Sim","Sim","Sim","Não","Não","Não","Sim","Não","Não","Não","Sim","Não","Não","Não","Não","Não","Não"
"26","245","07/01/2020 - 12:30","14/01/2020 - 12:06","14/01/2020 - 12:06","0","143.107.174.1","158","fsp","Faculdade de Saúde Pública","216","1850","0","0","2","1","0","1","8","2","5","2","4","4","0","0","0","0","0","0","0","0","0","0","0","5","0","2","9","5","0","0","0","0","https://indicadores.abcd.usp.br/sites/default/files/webform/158_2.xlsx","15","101","0","0","0","131","16","0","0","0","0","213","0","2","15","0","0","109","152","2","0","0","0","2","0","0","0","0","0","262","0","0","0","0","0","330363","384","0","0","0","0","0","0","42.063","10.636","15.999","19","57","8","576","43","11","599","0","0","0","53","1","1.539","0","0","0","4","0","0","0","0","0","0","0","0","0","11.920","34","470","28","27","0","8","0","7","1","10","Lilacs/Bireme - Base Internacional - 201 registros
e-Coleções - Base nacional institucional da FSP/USP - 571 registros","Biblioteca/CIR em Números – periodicidade: anual; formato: online. Distribuição: doação.
Novidades no Acervo Biblioteca/CIR – periodicidade: mensal; formato: online. Distribuição: doação.
Roteiro Curso PubMed/Medline – periodicidade: anual; formato: impresso. Distribuição: doação.
Calendário de Funcionamento – periodicidade: anual; formatos: impresso/online. Distribuição: doação.
Agenda Coletiva da Biblioteca – periodicidade: anual; formato: online. Distribuição: doação.
Site da Biblioteca – formato: online. Distribuição: doação.
Blog da Biblioteca da FSP/USP – formato: online. Distribuição: doação.
Facebook da Biblioteca (Fan Page) – formato: online. Distribuição: doação.
Twitter da Biblioteca – formato: online. Distribuição: doação.
","Revista de Saúde Pública - formato: online; distribuição: doação; nível e participação da Biblioteca: Editoração, Normalização Técnica, Infraestrutura Administrativa, Distribuição ou Divulgação.

Saúde e Sociedade – formato: online; distribuição: doação; nível e participação da Biblioteca: Normalização Técnica, Infraestrutura Administrativa.

Livro eletrônico: Inovação nas práticas e ações rumo à sustentabilidade – formato: online; distribuição: doação; nível e participação da Biblioteca: Comissão responsável pela publicação, Editoração, Normalização Técnica, Infraestrutura Administrativa, Produção Gráfica, Distribuição ou Divulgação.

Livro eletrônico: Alimentação e saúde: a fundamentação científica do Guia Alimentar para População Brasileira – formato: online; distribuição: doação; nível e participação da Biblioteca: Comissão responsável pela publicação, Editoração, Normalização Técnica, Infraestrutura Administrativa, Produção Gráfica, Distribuição ou Divulgação.

Livro eletrônico: Cem anos em saúde pública: a trajetória acadêmico-institucional da FSP/USP - 1918-2018 – formato: online; distribuição: doação; nível e participação da Biblioteca: Comissão responsável pela publicação, Editoração, Normalização Técnica, Infraestrutura Administrativa, Produção Gráfica, Distribuição ou Divulgação.

Livro eletrônico: Food and health: the scientific evidence informing the dietary guidelines for the Brazilian population – formato: online; distribuição: doação; nível e participação da Biblioteca: Comissão responsável pela publicação, Editoração, Normalização Técnica, Infraestrutura Administrativa, Produção Gráfica, Distribuição ou Divulgação.

Livro eletrônico: Pegadas dos alimentos e das preparações culinárias consumidos no Brasil – formato: online; distribuição: doação; nível e participação da Biblioteca: Comissão responsável pela publicação, Editoração, Normalização Técnica, Infraestrutura Administrativa, Produção Gráfica, Distribuição ou Divulgação.

Livro eletrônico: Ciência pós-normal: ampliando o dialógo com a sociedade diante das crises ambientais contemporâneas – formato: online; distribuição: doação; nível e participação da Biblioteca: Comissão responsável pela publicação, Editoração, Normalização Técnica, Infraestrutura Administrativa, Produção Gráfica, Distribuição ou Divulgação.

Livro eletrônico: Aprendizagem social e ferramentas participativas para o nexo urbano: aprendendo juntos para promover um futuro melhor – formato: online; distribuição: doação; nível e participação da Biblioteca: Comissão responsável pela publicação, Editoração, Normalização Técnica, Infraestrutura Administrativa, Produção Gráfica, Distribuição ou Divulgação.

Livro eletrônico: Social learning - dialogues and a participatory toolkit for the water, energy and food nexus: learning together to promote a better future – formato: online; distribuição: doação; nível e participação da Biblioteca: Comissão responsável pela publicação, Editoração, Normalização Técnica, Infraestrutura Administrativa, Produção Gráfica, Distribuição ou Divulgação.","Curso sobre Circulação e Empréstimo para Equipes de Biblioteca – USP São Paulo – FSP
Período: 03/04/2019 (9h às 17h)
Patrocinador: SIBiUSP, CQ/USP
Tipo de evento: Curso
Nível de participação da Biblioteca: Participação na Comissão Organizadora e Divulgação.

XXII Semana do Livro e da Biblioteca e Semana Internacional do Acesso Aberto – “O Acesso Aberto – Open Access”
Período: 26/10/2019 a 30/10/2019 (8h às 20h)
Patrocinador: Biblioteca da FSP/USP
Tipo de evento: Exposição, Comunicação
Nível de participação da Biblioteca: Evento totalmente realizado pela Biblioteca.
","","Colaboração na Disciplina HSM0121 - Informação Bibliográfica em Saúde Pública - Curso Bacharelado em Saúde Pública. Treinamento em bases de dados e orientação referente às normas bibliográficas.

Colaboração na Disciplina 60018 Comunicação e Informação: Atividade Integradora - Curso de Nutrição, período matutino e noturno. Treinamento em bases de dados e orientação referente às normas bibliográficas.","Campanha de Arrecadação de livros infanto-juvenis
Período: 03/06/2019 a 28/06/2019 (9h às 17h)
Patrocinador: Biblioteca da FSP/USP, Comissão de Cultura e Extensão da FSP/USP
Tipo de evento: Outros
Nível de participação da Biblioteca: Evento totalmente realizado pela Biblioteca.

Participação no evento ""USP e as Profissões"", organizado pela Faculdade de Saúde Pública – 28/08/2019.

Divulgação de informação em saúde em redes sociais: Blog, Facebook, Twitter.

Biblioteca Virtual em Saúde - Saúde Pública

Biblioteca Virtual em Bioética e Diplomacia em Saúde - membro do Comitê Consultivo
","Sim","Sim","Sim","http://www.facebook.com/bibfsp","@bibfsp_usp","http://www.fsp.usp.br/biblioteca/blog","http://www.flickr.com/photos/bibfsp/ ","","","","Sim","Não","Não","Sim","Sim","Sim","Sim","Não","Sim","Não","Não","Não","Sim","Não","Não","Não","Não","Não","Não"
"27","246","07/01/2020 - 12:54","21/01/2020 - 16:53","21/01/2020 - 16:53","0","200.144.202.53","177","mac","Museu de Arte Contemporânea","20","405","0","0","1","0","0","1","2","1","0","0","0","8","0","0","0","0","0","0","0","0","0","0","0","0","0","0","1","2","0","0","1","0","","","0","0","26","22","86","109","0","0","0","0","0","0","0","3","1","0","0","0","0","0","0","0","12","11","0","0","0","0","42","38","0","0","0","0","10170","330","0","0","0","29406","0","37625","2187","1984","12444","2","0","0","7","1","0","12","0","0","0","0","0","0","0","0","0","0","0","0","0","0","0","0","0","0","0","692","13","194","4","5","1","2","1","2","3","0","Catálogos Coletivos/Individuais (Base Local da Biblioteca) 22
Coleção de Catálogos de Artistas do Acervo MAC USP (Base Local da Biblioteca) 59
Tombo de Livros (Base Local da Biblioteca) 162
Biblioteca Walter Zanini (Base Local da Biblioteca) 528","-","CHIARELLI, Tadeu (Org.). Acervo : outras abordagens, vol. 2. 2. ed. rev. ampl. São Paulo: MAC-USP, 2019. 138 p. (Periodicidade: Desconhecida. Formato: e-book (pdf). Nível de Participação da Biblioteca: Normalização técnica.)

COSTA, Helouise (Org.). Fronteiras incertas : arte e fotografia no acervo do MAC USP (1963-1978). São Paulo: MAC-USP, 2019. 204 p. (Periodicidade: Desconhecida. Formato: e-book (pdf). Nível de Participação da Biblioteca: Normalização técnica.)

FREIRE, Cristina (Org.). Sobre exposições : conceitualismos em mostras no MAC USP (2000-2015). São Paulo: MAC-USP, 2019. 391 p. (Periodicidade: Desconhecida. Formato: e-book (pdf). Nível de Participação da Biblioteca: Normalização técnica.)

FREIRE, Cristina (Org.). Terra Brasilis : arte brasileira no acervo conceitual do MAC USP. São Paulo: MAC-USP, 2019. 366 p. (Periodicidade: Desconhecida. Formato: e-book (pdf). Nível de Participação da Biblioteca: Normalização técnica.)

MAGALHÃES, Ana G. (Org.). Atelier 17 and modern printmaking in the Americas. São Paulo: MAC-USP, 2019. 225 p. (Periodicidade: Desconhecida. Formato: e-book (pdf). Nível de Participação da Biblioteca: Normalização técnica.)

MAGALHÃES, Ana G. (Org.). Atelier 17 e a gravura moderna nas Américas. São Paulo: MAC-USP, 2019. 225 p. (Periodicidade: Desconhecida. Formato: e-book (pdf). Nível de Participação da Biblioteca: Normalização técnica.)

MAGALHÃES, Ana G. (Org.). Atelier 17 e a gravura moderna nas Américas. São Paulo: MAC-USP, 2019. 225 p. (Periodicidade: Desconhecida. Formato: brochura. Nível de Participação da Biblioteca: Normalização técnica.)

MAGALHÃES, Ana G. (Org.). Um outro acervo do MAC USP. São Paulo: MAC-USP, 2019. 160 p. (Periodicidade: Desconhecida. Formato: e-book (pdf). Nível de Participação da Biblioteca: Normalização técnica.)

MAGALHÃES, Ana G.; COSTA, Helouise (Orgs.). Novas aquisições do acervo MAC USP. São Paulo: MAC-USP, 2019. 180 p. (Periodicidade: Desconhecida. Formato: e-book (pdf). Nível de Participação da Biblioteca: Normalização técnica.)

MAGALHÃES, Ana G.; COSTA, Helouise; LEITE, Edson (Orgs.). Guia do acervo MAC USP. São Paulo: MAC-USP, 2019. 88 p. (Periodicidade: Desconhecida. Formato: e-book (pdf). Nível de Participação da Biblioteca: Normalização técnica.)","-","-","-","-","Sim","Sim","Não","","","","","","","","Sim","Não","Não","Não","Sim","Não","Sim","Não","Não","Não","Não","Não","Sim","Não","Sim","Não","Não","Não","Não"
