"9","228","03/12/2019 - 16:28","31/01/2020 - 14:40","31/01/2020 - 14:40","0","143.107.24.208","157","fob","Faculdade de Odontologia de Bauru","265","3.172","0","0","1","5","2","1","5","6","0","0","0","2","0","0","0","0","0","0","0","0","0","0","0","3","1","0","6","0","0","0","1","0","https://indicadores.abcd.usp.br/sites/default/files/webform/157_2.xlsx","15","1737","1","0","0","1216","233","0","0","0","0","214","0","1","0","0","0","113","57","0","0","0","0","90","5","0","1","0","0","1","1","0","0","0","0","138601","345","0","0","0","0","0","0","118981","5421","4145","87","38","12","289","86","78","595","0","0","0","140","0","1725","3","1","16","13","1","18","9","0","0","1","1","7","2","3836","1670","11386","73","24","0","7","0","6","0","5","BBO - Bibliografia Brasileira de Odontologia = zero
LILACS - Literatura Latino-Americana e do Caribe em Ciências da Saúde = zero
SeCS - Seriados em Ciências da Saúde = 1085
","Acesso à Internet na USP: Rede sem Fio e VPN (FOB) – irregular – impressa e online – doação
Conheça a Biblioteca [guia de serviços da Biblioteca FOB/USP] – irregular – impresso – doação
Como agrupar o Author ID na Scopus? – irregular – online – doação
Dedalus: Banco de Dados Bibliográficos da USP – irregular – online – doação
Formas de comunicação científica: periódicos – irregular – online – doação
PubMed (Medline) – irregular – online – doação
Revistas científicas: acesso eletrônico – irregular – online – doação
Teses, dissertações e livros: acesso eletrônico – irregular – online – doação
Wiley - Livros Eletrônicos – irregular – online – doação
Guia para elaboração de referências: ABNT NBR 6023:2018 – irregular – online –doação
Guia para elaboração de citações em documentos: ABNT NBR 10520:2002 – irregular – online – doação
Guia para elaboração de referências Vancouver – ICMJE – irregular – online – doação
Guia para elaboração de trabalhos acadêmicos (dissertações/teses – formato convencional): ABNT NBR 14724:2011 – irregular – online – doação
Guia para elaboração de trabalhos acadêmicos (dissertações/teses – formato por artigo) – irregular – online – doação
Guia para elaboração de trabalhos acadêmicos (trabalhos de conclusão de curso): ABNT NBR 14724:2011 – irregular – online – doação
Gabarito para elaboração do trabalho de conclusão de curso – irregular – online – doação
Gabarito da Dissertação/tese formato convencional – Pré-textual FOB – irregular – online – doação
Gabarito da Dissertação/tese formato convencional – Textual e pós-textual FOB
 – irregular – online – doação
Gabarito da Dissertação/tese formato convencional – Pré-textual HRAC – irregular – online – doação
Gabarito da Dissertação/tese formato convencional – Textual e pós-textual HRAC
 – irregular – online – doação
Gabarito da Dissertação/tese formato por artigo – Pré-textual FOB – irregular – online – doação
Gabarito da Dissertação/tese formato por artigo – Pré-textual HRAC – irregular – online – doação
Configurando o arquivo da parte pré-textual da dissertação ou tese (Word) – Video (YouTube) – irregular – online – doação
Configurando o arquivo da parte textual e pós-textual da dissertação ou tese (Word) – Video (YouTube) – irregular – online – doação
Elaborando listas e sumário (Word) – Video (YouTube) – irregular – online – doação
Quebra de seção (Word) – Video (YouTube) – irregular – online – doação
Títulos abreviados das revistas – PubMed – Video (YouTube) – irregular – online – doação
Títulos abreviados das revistas – Portal BVS – Video (YouTube) – irregular – online – doação

","Journal of Applied Oral Science (1678-7765) – publicação contínua (volumes anuais, sem fascículos) – online – doação – comissão responsável pela publicação, normalização técnica, infraestrutura administrativa, distribuição e divulgação.
PET Informa (ISSN 1806-6151) –  semestral – online – normalização técnica
Catálogo de Graduação – anual – online – doação – comissão responsável pela publicação e normalização técnica 
Relatório de Gestão – a cada 4 anos – impresso e online – doação – comissão responsável pela publicação e normalização técnica

","Não se aplica.","Não se aplica.","- Participação na Semana de Recepção aos Calouros, com apresentação sobre a Biblioteca
- Participação em aulas dos cursos de Odontologia, Fonoaudiologia e Medicina, a convite dos docentes
- Promoção de treinamento sobre pesquisa e normalização para alunos do grupo PET e de Iniciação Científica
- Participação e auxílio em atividades de publicação do PET Informa
","- Parceria com o Centro Cultural da Prefeitura do Campus USP Bauru para realização de exposições artísticas, no hall de entrada da Biblioteca.","Sim","Sim","Sim","https://www.facebook.com/BibliotecaFOBUSP/","https://twitter.com/bibfobusp","https://sddinforma.fob.usp.br ","https://www.flickr.com/people/56370315@N03/","https://br.pinterest.com/bibfobusp/","https://www.youtube.com/user/bibfobusp","https://www.youtube.com/channel/UCOBOJMP5PqOalEmXCev1Npg ","Não","Não","Sim","Não","Sim","Sim","Não","Não","Não","Não","Não","Não","Não","Não","Não","Não","Não","Não","Não"
"10","229","03/12/2019 - 16:58","29/01/2020 - 15:09","29/01/2020 - 15:09","0","143.107.121.42","164","icb","Instituto de Ciências Biomédicas","196","1.165","0","0","1","3","0","0","1","4","1","0","0","0","0","0","0","0","0","0","0","0","0","0","0","0","0","0","0","0","0","0","0","0","https://indicadores.abcd.usp.br/sites/default/files/webform/164_3.xlsx","13","19","0","0","0","280","0","0","0","0","0","119","0","0","0","0","0","42","212","0","0","0","0","0","0","0","0","0","0","29","316","90","516","3","84","116.291","254","0","2","0","12940","6","167","37.346","66","2.733","3","18","2","155","17","12","105","0","0","0","3","0","10","1","1","4","5","5","0","0","0","0","11","1","0","0","157","0","0","38","15","0","2","0","1","7","5","Aquisição: 19;
Agendamento Sala de Treinamento: 34;
Produção Científica: 345.","Vídeo tutorial de normalização técnica do ICB (on-line);
Vídeo tutorial de normalização técnica da Biotecnologia (on-line);
Estrutura do trabalho ABNT - Programa de Pós-graduação do ICB (on-line);
Estrutura do trabalho Vancouver - Programa de Pós-graduação do ICB (on-line);
Estrutura do trabalho ABNT - Programa de Pós-graduação em Biotecnologia (on-line);
Estrutura do trabalho Vancouver - Programa de Pós-graduação em Biotecnologia (on-line);
Tutorial ICB para uso da ferramenta de busca de repositórios de dados re3data (on-line);
Folderes impressos, com distribuição gratuita, sobre: produtos e serviços da Biblioteca e do Sistema Integrado de Bibliotecas da USP, direcionados a: alunos de graduação e pós-graduação, USP e as Profissões, Cursos de Verão e Inverno dos Departamentos do ICB, Virada Científica; Roteiros de 1º acesso ao DEDALUS, renovação e reserva de material bibliográfico; Guia rápido para submissão de trabalhos acadêmicos na Biblioteca Digital de Teses e Dissertações da USP BDTD;
Lista de contatos do ICB.
","","","","Visitas orientadas;
Treinamentos em fontes de informação, produtos e serviços do SBiB  e SIBi/USP.
","Comissão de Apoio à Comunidade do ICB (CAC-ICB): Setembro Amarelo;
","Sim","Sim","Não","","","","","","","","Sim","Não","Não","Não","Sim","Sim","Sim","Não","Sim","Não","Sim","Não","Sim","Não","Não","Não","Não","Não","Não"
"11","230","04/12/2019 - 09:23","07/01/2020 - 17:42","20/02/2020 - 14:33","0","143.107.211.194","138","cena","Centro de Energia Nuclear na Agricultura","21","277","0","0","2","0","0","0","0","1","0","1","0","0","0","0","0","0","0","0","0","0","0","0","0","0","0","0","0","0","0","0","0","0","","","5","3","0","0","21","5","0","0","0","0","29","0","0","0","0","0","13","2","0","0","0","0","0","0","0","0","0","0","0","0","0","0","0","0","26653","15","0","0","0","0","0","0","873","512","342","23","6","0","33","6","0","57","0","0","0","0","0","0","0","0","0","30","0","0","0","0","0","0","0","0","0","386","65","7282","10","6","1","2","1","1","2","4","Não pertinente","- Biblioteca Divulga (online)","- Relatório de Atividades do CENA/USP
- Scientia Agricola
- Série Didática
- Série Manuais","Não pertinente","Não pertinente","Não pertinente","Não pertinente","Sim","Sim","Sim","https://www.facebook.com/biblioteca.cenausp","https://twitter.com/biblioteca_CENA","","","","","https://www.instagram.com/biblioteca.cena.usp/","Sim","Não","Não","Não","Sim","Não","Sim","Não","Não","Não","Não","Não","Sim","Não","Não","Não","Não","Não","Não"
"12","231","09/12/2019 - 14:56","17/01/2020 - 12:53","17/01/2020 - 12:53","0","200.144.214.51","150","fdrp","Faculdade de Direito de Ribeirão Preto","120","800","0","0","3","1","2","1","2","1","0","0","0","0","0","0","0","0","0","0","0","0","0","0","0","0","0","0","0","0","0","0","0","0","","","72","19","0","0","1409","240","0","0","0","0","50","0","0","0","0","0","2","0","0","0","0","0","0","0","0","0","0","0","0","0","0","1000","0","0","5298","145","0","0","0","0","0","0","94598","0","11786","304","1","1","20","3","4","65","0","0","0","5","0","140","0","0","0","17","1","4","4","0","0","0","0","0","0","60","11","300","9","10","0","2","1","0","0","0","","","","Palestra ""Pesquisa bibliográfica em bases de dados"". 
Palestra  ""Cadastramento ORCid/Preenchimento do Currículo Lattes"" para os alunos do Programa de Pós-Graduação em Direito.
Palestra “Boas práticas científicas no desenvolvimento de pesquisas jurídicas: a escolha de fontes de informação jurídica"". Evento: I SEMINÁRIO DE PESQUISA DA FDRP/USP “DESENVOLVIMENTO NO ESTADO DEMOCRÁTICO DE DIREITO”. 


","","","Campanha de arrecadação de livros para doação ao Centro de Progressão Penitenciária de Jardinópolis","Sim","Sim","Sim","","","","","","","Instagram @bibliotecafdrp","Não","Não","Sim","Sim","Não","Sim","Não","Não","Não","Não","Não","Não","Não","Não","Não","Não","Não","Não","Não"
